{
  "claimVersion": "1",
  "claimedBy": {
    "system": "Northstar Tool Registry",
    "organization": "Example Adopter Organization"
  },
  "claimedAt": "2026-05-10T20:00:00Z",
  "agrpVersion": "v1",
  "conformanceLevel": "baseline",
  "claimElements": [
    {
      "element": "semantic-alignment",
      "evidence": "Tool resources, registration records, lineage nodes, audit records, lifecycle transitions, and capability advertisements are all schema-valid; see examples/adaptations/northstar-tool-registry/manifest.json"
    },
    {
      "element": "schema-compatibility",
      "evidence": "14 of 15 bundle artifacts are JSON-Schema-validated against the six baseline schemas (resource-entity, registration-record, lineage-node, audit-record, lifecycle-transition, capability-advertisement); the 15th is prose-validated per the evidence-attestation contract"
    },
    {
      "element": "lifecycle-lineage-restore-audit-preservation",
      "evidence": "v1 to v2 lineage chain, audit records at each create/update/transition step, lifecycle transition draft to active. See docs/adaptations/northstar-tool-registry.md and tools/adaptations/replay-northstar.py for the lifecycle replay proof."
    },
    {
      "element": "transport-neutral-control-plane-preservation",
      "evidence": "RegisterResourceVersion and TransitionLifecycleState envelopes are JSON-on-the-wire shapes that compose with HTTP, gRPC, message-queue, or any other binding without affecting AGRP-side semantics"
    }
  ],
  "schemasInScope": [
    "models/schemas/resource-entity.schema.json",
    "models/schemas/registration-record.schema.json",
    "models/schemas/lineage-node.schema.json",
    "models/schemas/audit-record.schema.json",
    "models/schemas/lifecycle-transition.schema.json",
    "models/schemas/capability-advertisement.schema.json",
    "models/schemas/control-plane-envelope.schema.json"
  ],
  "operationsInScope": [
    "RegisterResourceVersion",
    "TransitionLifecycleState"
  ],
  "errorCategoriesInScope": [
    "validation_error",
    "not_found",
    "conflict"
  ],
  "bundleReference": {
    "path": "examples/adaptations/northstar-tool-registry",
    "designDoc": "docs/adaptations/northstar-tool-registry.md",
    "manifest": "examples/adaptations/northstar-tool-registry/manifest.json"
  },
  "attestation": {
    "evidenceId": "northstar-bundle-attestation-2026-05-10",
    "subject": "examples/adaptations/northstar-tool-registry",
    "evidenceType": "lifecycle-replay-record",
    "attestationStatus": "self-attested",
    "observedAt": "2026-05-10T20:00:00Z",
    "attestorId": "example-attestor-northstar",
    "attestedAt": "2026-05-10T20:00:00Z",
    "validUntil": "2027-05-10T20:00:00Z"
  }
}
