{
  "claimVersion": "1",
  "claimedBy": {
    "system": "Helios Governance Registry",
    "organization": "Example Adopter Organization"
  },
  "claimedAt": "2026-05-10T20:00:00Z",
  "agrpVersion": "v1",
  "conformanceLevel": "baseline",
  "claimElements": [
    {
      "element": "semantic-alignment",
      "evidence": "Policy-revision resources, propose/review/commit audit records, lineage nodes (draft + committed), lifecycle transitions, capability advertisements, and two profile declarations (proposer-scope, privacy-tier) are all schema-valid; see examples/adaptations/helios-governance-registry/manifest.json"
    },
    {
      "element": "schema-compatibility",
      "evidence": "16 of 19 bundle artifacts are JSON-Schema-validated against the seven baseline schemas; the 3 prose-validated artifacts (slots 06, 08, 13) are evidence-attestation files including the redacted review evidence at slot 08 (examples/adaptations/helios-governance-registry/08-evidence-attestation.review.redacted.example.json)"
    },
    {
      "element": "lifecycle-lineage-restore-audit-preservation",
      "evidence": "Three audit records (proposal/review/commit) demonstrate the governance flow; lineage chain from draft to committed; transition draft to active; privacy-tier profile declaration at slot 17 demonstrates redaction policy at rest. See docs/adaptations/helios-governance-registry.md."
    },
    {
      "element": "transport-neutral-control-plane-preservation",
      "evidence": "Governance envelopes carry proposal/review/commit semantics independent of any transport binding; redaction of review evidence is a transport-neutral concern enforced by the privacy-tier profile declaration at examples/adaptations/helios-governance-registry/17-profile-declaration.privacy-tier.example.json"
    }
  ],
  "schemasInScope": [
    "models/schemas/resource-entity.schema.json",
    "models/schemas/registration-record.schema.json",
    "models/schemas/lineage-node.schema.json",
    "models/schemas/audit-record.schema.json",
    "models/schemas/lifecycle-transition.schema.json",
    "models/schemas/capability-advertisement.schema.json",
    "models/schemas/profile-declaration.schema.json",
    "models/schemas/control-plane-envelope.schema.json"
  ],
  "operationsInScope": [
    "RegisterResourceVersion",
    "TransitionLifecycleState"
  ],
  "errorCategoriesInScope": [
    "validation_error",
    "not_found",
    "conflict",
    "policy_denied",
    "access_denied"
  ],
  "bundleReference": {
    "path": "examples/adaptations/helios-governance-registry",
    "designDoc": "docs/adaptations/helios-governance-registry.md",
    "manifest": "examples/adaptations/helios-governance-registry/manifest.json"
  }
}
